Rank	Title	Status	Study Results	Conditions	Interventions	Locations	URL
160	Talimogene Laherparepvec and Nivolumab in Treating Patients With Refractory Lymphomas or Advanced or Refractory Non-melanoma Skin Cancers	Recruiting	No Results Available	Adenoid Cystic Skin Carcinoma|Adnexal Carcinoma|Anaplastic Large Cell Lymphoma, ALK-Negative|Anaplastic Large Cell Lymphoma, ALK-Positive|Apocrine Carcinoma|Cylindrocarcinoma|Digital Papillary Adenocarcinoma|Endocrine Mucin-Producing Sweat Gland Carcinoma|Extramammary Paget Disease|Extraocular Cutaneous Sebaceous Carcinoma|Hidradenocarcinoma|Keratoacanthoma|Malignant Sweat Gland Neoplasm|Merkel Cell Carcinoma|Microcystic Adnexal Carcinoma|NK-Cell Lymphoma, Unclassifiable|Papillary Adenocarcinoma|Porocarcinoma|Primary Cutaneous Mucinous Carcinoma|Recurrent Mature T-Cell and NK-Cell Non-Hodgkin Lymphoma|Recurrent T-Cell Non-Hodgkin Lymphoma|Refractory Anaplastic Large Cell Lymphoma|Refractory Mature T-Cell and NK-Cell Non-Hodgkin Lymphoma|Refractory Merkel Cell Carcinoma|Refractory Mycosis Fungoides|Refractory Primary Cutaneous T-Cell Non-Hodgkin Lymphoma|Refractory Skin Squamous Cell Carcinoma|Refractory T-Cell Non-Hodgkin Lymphoma|Sezary Syndrome|Signet Ring Cell Carcinoma|Skin Basal Cell Carcinoma|Skin Basosquamous Cell Carcinoma|Skin Squamous Cell Carcinoma|Spiradenocarcinoma|Squamoid Eccrine Ductal Carcinoma|Squamous Cell Carcinoma of Unknown Primary|Sweat Gland Carcinoma|Trichilemmal Carcinoma|Vulvar Squamous Cell Carcinoma	Other: Laboratory Biomarker Analysis|Biological: Nivolumab|Biological: Talimogene Laherparepvec	Los Angeles County-USC Medical Center, Los Angeles, California, United States|USC / Norris Comprehensive Cancer Center, Los Angeles, California, United States|UC Irvine Health/Chao Family Comprehensive Cancer Center, Orange, California, United States|University of California Davis Comprehensive Cancer Center, Sacramento, California, United States|University of Colorado Hospital, Aurora, Colorado, United States|UM Sylvester Comprehensive Cancer Center at Aventura, Aventura, Florida, United States|UM Sylvester Comprehensive Cancer Center at Coral Gables, Coral Gables, Florida, United States|UM Sylvester Comprehensive Cancer Center at Deerfield Beach, Deerfield Beach, Florida, United States|University of Miami Miller School of Medicine-Sylvester Cancer Center, Miami, Florida, United States|UM Sylvester Comprehensive Cancer Center at Kendall, Miami, Florida, United States|UM Sylvester Comprehensive Cancer Center at Plantation, Plantation, Florida, United States|Northwestern University, Chicago, Illinois, United States|University of Kansas Clinical Research Center, Fairway, Kansas, United States|University of Kansas Cancer Center-Overland Park, Overland Park, Kansas, United States|University of Kansas Hospital-Westwood Cancer Center, Westwood, Kansas, United States|Johns Hopkins University/Sidney Kimmel Cancer Center, Baltimore, Maryland, United States|Massachusetts General Hospital Cancer Center, Boston, Massachusetts, United States|Dana-Farber Cancer Institute, Boston, Massachusetts, United States|Siteman Cancer Center at West County Hospital, Creve Coeur, Missouri, United States|University of Kansas Cancer Center - North, Kansas City, Missouri, United States|University of Kansas Cancer Center - Lee's Summit, Lee's Summit, Missouri, United States|University of Kansas Cancer Center at North Kansas City Hospital, North Kansas City, Missouri, United States|Washington University School of Medicine, Saint Louis, Missouri, United States|Siteman Cancer Center-South County, Saint Louis, Missouri, United States|Siteman Cancer Center at Saint Peters Hospital, Saint Peters, Missouri, United States|University of Nebraska Medical Center, Omaha, Nebraska, United States|Dartmouth Hitchcock Medical Center, Lebanon, New Hampshire, United States|Rutgers Cancer Institute of New Jersey, New Brunswick, New Jersey, United States|Roswell Park Cancer Institute, Buffalo, New York, United States|Laura and Isaac Perlmutter Cancer Center at NYU Langone, New York, New York, United States|UNC Lineberger Comprehensive Cancer Center, Chapel Hill, North Carolina, United States|University of Pittsburgh Cancer Institute (UPCI), Pittsburgh, Pennsylvania, United States|Baylor College of Medicine/Dan L Duncan Comprehensive Cancer Center, Houston, Texas, United States|Huntsman Cancer Institute/University of Utah, Salt Lake City, Utah, United States	https://ClinicalTrials.gov/show/NCT02978625
161	Letermovir for the Prevention of Cytomegalovirus Reactivation in Patients With Hematological Malignancies Treated With Alemtuzumab	Recruiting	No Results Available	B-Cell Prolymphocytic Leukemia|Chronic Lymphocytic Leukemia|Peripheral T-Cell Lymphoma|Primary Cutaneous T-Cell Non-Hodgkin Lymphoma|Sezary Syndrome|T-Cell Prolymphocytic Leukemia	Drug: Letermovir	Ohio State University Comprehensive Cancer Center, Columbus, Ohio, United States	https://ClinicalTrials.gov/show/NCT04312841
162	CAR-37 T Cells In Hematologic Malignancies	Recruiting	No Results Available	Hematologic Malignancy|Leukemia|Lymphoma|Lymphoma, B-Cell|Lymphoma, T-Cell|Lymphoma, Non-Hodgkin	Biological: CAR-37 T cells	Massachusetts General Hospital Cancer Center, Boston, Massachusetts, United States	https://ClinicalTrials.gov/show/NCT04136275
163	CD7-CART in the Treatment of r / r CD7 Positive Hemolymph System Malignancies on Increasing Dose and Open Label Study	Recruiting	No Results Available	T Lymphoblastic Leukemia/Lymphoma|Extramedullary NK-T-cell Lymphoma, Nasal Type|Peripheral T-cell Lymphoma, Nonspecific|Angioimmunoblastic T-cell Lymphoma|Enteropathy-Associated T-Cell Lymphoma|Anaplastic Large Cell Lymphoma, ALK-negative|T-cell Lymphoblastic Leukemia	Biological: T cell injection targeting CD7 chimeric antigen receptor	First Affiliated Hospital of Zhengzhou University, Zhengzhou, Henan, China	https://ClinicalTrials.gov/show/NCT04480788
164	Reduced-Intensity Conditioning Before Donor Stem Cell Transplant in Treating Patients With High-Risk Hematologic Malignancies	Recruiting	No Results Available	Accelerated Phase Chronic Myelogenous Leukemia|Adult Acute Lymphoblastic Leukemia in Remission|Adult Acute Myeloid Leukemia With 11q23 (MLL) Abnormalities|Adult Acute Myeloid Leukemia With Del(5q)|Adult Nasal Type Extranodal NK/T-cell Lymphoma|Anaplastic Large Cell Lymphoma|Angioimmunoblastic T-cell Lymphoma|Blastic Phase Chronic Myelogenous Leukemia|Childhood Acute Lymphoblastic Leukemia in Remission|Childhood Burkitt Lymphoma|Childhood Chronic Myelogenous Leukemia|Childhood Diffuse Large Cell Lymphoma|Childhood Immunoblastic Large Cell Lymphoma|Childhood Myelodysplastic Syndromes|Childhood Nasal Type Extranodal NK/T-cell Lymphoma|Chronic Myelomonocytic Leukemia|Chronic Phase Chronic Myelogenous Leukemia|Cutaneous B-cell Non-Hodgkin Lymphoma|de Novo Myelodysplastic Syndromes|Essential Thrombocythemia|Extranodal Marginal Zone B-cell Lymphoma of Mucosa-associated Lymphoid Tissue|Hepatosplenic T-cell Lymphoma|Intraocular Lymphoma|Juvenile Myelomonocytic Leukemia|Nodal Marginal Zone B-cell Lymphoma|Noncutaneous Extranodal Lymphoma|Peripheral T-cell Lymphoma|Polycythemia Vera|Post-transplant Lymphoproliferative Disorder|Previously Treated Myelodysplastic Syndromes|Primary Myelofibrosis|Recurrent Adult Acute Myeloid Leukemia|Recurrent Adult Burkitt Lymphoma|Recurrent Adult Diffuse Large Cell Lymphoma|Recurrent Adult Diffuse Mixed Cell Lymphoma|Recurrent Adult Diffuse Small Cleaved Cell Lymphoma|Recurrent Adult Grade III Lymphomatoid Granulomatosis|Recurrent Adult Hodgkin Lymphoma|Recurrent Adult Immunoblastic Large Cell Lymphoma|Recurrent Adult Lymphoblastic Lymphoma|Recurrent Adult T-cell Leukemia/Lymphoma|Recurrent Childhood Acute Myeloid Leukemia|Recurrent Childhood Anaplastic Large Cell Lymphoma|Recurrent Childhood Grade III Lymphomatoid Granulomatosis|Recurrent Childhood Large Cell Lymphoma|Recurrent Childhood Lymphoblastic Lymphoma|Recurrent Childhood Small Noncleaved Cell Lymphoma|Recurrent Cutaneous T-cell Non-Hodgkin Lymphoma|Recurrent Grade 1 Follicular Lymphoma|Recurrent Grade 2 Follicular Lymphoma|Recurrent Grade 3 Follicular Lymphoma|Recurrent Mantle Cell Lymphoma|Recurrent Marginal Zone Lymphoma|Recurrent Mycosis Fungoides/Sezary Syndrome|Recurrent Small Lymphocytic Lymphoma|Recurrent/Refractory Childhood Hodgkin Lymphoma|Refractory Anemia With Excess Blasts|Refractory Anemia With Excess Blasts in Transformation|Refractory Cytopenia With Multilineage Dysplasia|Refractory Hairy Cell Leukemia|Refractory Multiple Myeloma|Relapsing Chronic Myelogenous Leukemia|Secondary Acute Myeloid Leukemia|Small Intestine Lymphoma|Splenic Marginal Zone Lymphoma|T-cell Large Granular Lymphocyte Leukemia|Testicular Lymphoma|Waldenström Macroglobulinemia	Drug: Fludarabine phosphate|Drug: Thiotepa|Radiation: Total body irradiation|Biological: Therapeutic allogeneic lymphocytes|Drug: Cyclophosphamide|Procedure: Allogeneic hematopoietic stem cell transplantation (HSCT)|Procedure: Peripheral blood stem cell transplantation|Drug: Tacrolimus|Drug: Mycophenolate mofetil	Thomas Jefferson University, Philadelphia, Pennsylvania, United States	https://ClinicalTrials.gov/show/NCT01760655
165	Pembrolizumab and External Beam Radiation Therapy in Treating Patients With Relapsed or Refractory Non-Hodgkin Lymphoma	Recruiting	No Results Available	Primary Mediastinal (Thymic) Large B-Cell Lymphoma|Recurrent Aggressive Non-Hodgkin Lymphoma|Recurrent Mature T- Cell and NK-Cell Non-Hodgkin Lymphoma|Recurrent Non-Hodgkin Lymphoma|Recurrent T-Cell Non-Hodgkin Lymphoma|Recurrent Transformed Follicular Lymphoma to Diffuse Large B-Cell Lymphoma|Refractory Aggressive Non-Hodgkin Lymphoma|Refractory Non-Hodgkin Lymphoma|Refractory T-Cell Non-Hodgkin Lymphoma|Refractory Transformed Follicular Lymphoma to Diffuse Large B-Cell Lymphoma|Transformed Marginal Zone Lymphoma to Diffuse Large B-Cell Lymphoma	Radiation: External Beam Radiation Therapy|Biological: Pembrolizumab	M D Anderson Cancer Center, Houston, Texas, United States	https://ClinicalTrials.gov/show/NCT03210662
166	Safety and Efficacy of CT125A Cells for Treatment of Relapsed/Refractory CD5+ Hematopoietic Malignancies	Not yet recruiting	No Results Available	CD5+ Relapsed/Refractory Hematopoietic Malignancies|Chronic Lymphocytic Leukemia (CLL)|Mantle Cell Lymphoma (MCL)|Diffuse Large B-cell Lymphoma (DLBCL)|Follicular Lymphoma (FL)|Peripheral T-cell Lymphomas (PTCL)	Biological: CT125A cells|Drug: Cyclophosphamide, fludarabine		https://ClinicalTrials.gov/show/NCT04767308
167	Safety and Efficacy of OT-82 in Participants With Relapsed or Refractory Lymphoma	Recruiting	No Results Available	Lymphoma|Lymphoma, Non-Hodgkin|Lymphoma, B-Cell|Lymphoma, T-Cell|Lymphoma, Follicular|Lymphoma, Peripheral T-Cell|Lymphoma, Hodgkin	Drug: OT-82 Dose Escalation|Drug: OT-82 Dose Expansion	University of Alabama at Birmingham, Birmingham, Alabama, United States|City of Hope National Medical Center, Duarte, California, United States|Sylvester Comprehensive Cancer Center, Miami, Florida, United States|University of Michigan, Ann Arbor, Michigan, United States|Roswell Park Cancer Institute, Buffalo, New York, United States|University Hospitals Seidman Cancer Center, Cleveland, Ohio, United States|Stephenson Cancer Center, Oklahoma City, Oklahoma, United States|Thomas Jefferson University Hospital, Philadelphia, Pennsylvania, United States	https://ClinicalTrials.gov/show/NCT03921879
168	A Clinical Trial of BP1002 in Patients With Advanced Lymphoid Malignancies	Recruiting	No Results Available	Mantle Cell Lymphoma|Peripheral T-cell Lymphoma (PTCL)|Cutaneous T-cell Lymphoma (CTCL)|Chronic Lymphocytic Leukemia (CLL)|Small Lymphocytic Lymphoma (SLL)|Follicular Lymphoma|Marginal Zone Lymphoma|Hodgkin Lymphoma|Waldenstrom Macroglobulinemia|DLBCL	Drug: L-Bcl-2 antisense oligonucleotide	Georgia Cancer Center, Augusta, Georgia, United States|Sarah Cannon Research Institute/Tennesee Oncology, Nashville, Tennessee, United States|MD Anderson Cancer Research Center, Houston, Texas, United States	https://ClinicalTrials.gov/show/NCT04072458
169	Study Evaluating GZ17-6.02 in Patients With Advanced Solid Tumors or Lymphoma	Recruiting	No Results Available	Advanced Cancer|Gastric Cancer|Breast Cancer|Pancreatic Cancer|Prostate Cancer Metastatic|Colo-rectal Cancer|Solid Tumor|Solid Carcinoma|Solid Carcinoma of Stomach|Cancer of Stomach|Lymphoma|Sarcoma|Cutaneous T Cell Lymphoma|Head and Neck Squamous Cell Carcinoma|Basal Cell Carcinoma|Cutaneous T-cell Lymphoma|Cutaneous Squamous Cell Carcinoma	Drug: GZ17-6.02	HonorHealth Research Institute, Scottsdale, Arizona, United States|Cedars-Sinai Medical Center, Los Angeles, California, United States|Ochsner Clinic Foundation, New Orleans, Louisiana, United States	https://ClinicalTrials.gov/show/NCT03775525
170	Mechanisms of Action of Photo(Chemo)Therapy in Skin Diseases	Recruiting	No Results Available	Psoriasis|Cutaneous T Cell Lymphoma|Lymphoproliferative Disorders|Eczema|Lichen Planus|Prurigo|Pruritus|Polymorphic Light Eruption|Graft Vs Host Disease|Mastocytosis|Vitiligo	Other: Photo(chemo)therapy	Medical University of Graz, Department of Dermatology, Graz, Styria, Austria	https://ClinicalTrials.gov/show/NCT03340155
171	A Safety Study of SEA-TGT (SGN-TGT) in Advanced Cancer	Recruiting	No Results Available	Non-small Cell Lung Cancer|Gastric Carcinoma|Gastroesophageal Junction Carcinoma|Classical Hodgkin Lymphoma|Diffuse Large B-cell Lymphoma|Peripheral T-cell Lymphoma|Cutaneous Melanoma|Head and Neck Squamous Cell Carcinoma|Bladder Cancer|Ovarian Cancer|Triple Negative Breast Cancer|Cervical Cancer	Drug: SEA-TGT|Drug: sasanlimab	University of Alabama at Birmingham, Birmingham, Alabama, United States|City of Hope National Medical Center, Duarte, California, United States|Mayo Clinic Rochester, Rochester, Minnesota, United States|Providence Portland Medical Center, Portland, Oregon, United States|University of Pittsburgh Medical Center (UPMC)/Hillman Cancer Center, Pittsburgh, Pennsylvania, United States|Institut Gustave Roussy, Villejuif-Cedex-France, Other, France|Istituto Europeo di Oncologia, Milano, Other, Italy|Hospital Universitario Vall d'Hebron, Barcelona, Other, Spain|The Royal Marsden Hospital (Surrey), Sutton, Other, United Kingdom	https://ClinicalTrials.gov/show/NCT04254107
172	BR101801 in Adult Patients With Advanced Hematologic Malignancies( Phase I)	Recruiting	No Results Available	Diffuse Large B Cell Lymphoma|Follicular Lymphoma|Chronic Lymphocytic Leukemia|Small Lymphocytic Leukemia|B Cell Lymphoma|Marginal Zone Lymphoma|Waldenstrom Macroglobulinemia|Peripheral T Cell Lymphoma	Drug: BR101801 (Phase Ia)|Drug: BR101801 (Phase Ib)	Asan Medical Center, Seoul, Korea, Republic of|Samsung Medical Center, Seoul, Korea, Republic of|Seoul national university hospital, Seoul, Korea, Republic of	https://ClinicalTrials.gov/show/NCT04018248
173	A Phase 1/2 Study of In Situ Vaccination With Tremelimumab and IV Durvalumab Plus PolyICLC in Subjects With Advanced, Measurable, Biopsy-accessible Cancers	Recruiting	No Results Available	Head and Neck Squamous Cell Carcinoma|Breast Cancer|Sarcoma|Merkel Cell Carcinoma|Cutaneous T-Cell Lymphoma|Melanoma|Renal Cancer|Bladder Cancer|Prostate Cancer|Testicular Cancer|Solid Tumor	Drug: Durvalumab|Drug: Tremelimumab|Drug: Poly ICLC	Research Facility, Atlanta, Georgia, United States|Research Facility, Lebanon, New Hampshire, United States|Research Facility, Buffalo, New York, United States|Research Facility, New York, New York, United States|Research Facility, Cleveland, Ohio, United States|Research Facility, Toledo, Ohio, United States|Research Facility, Charlottesville, Virginia, United States	https://ClinicalTrials.gov/show/NCT02643303
174	A Phase 1 Dose-Escalation and Cohort-Expansion of VLS-101 in Hematologic Malignancies	Recruiting	No Results Available	Chronic Lymphocytic Leukemia|Mantle Cell Lymphoma|Follicular Lymphoma|Marginal Zone Lymphoma|Diffuse Large B-cell Lymphoma|Richter Transformation Lymphoma|Burkitt Lymphoma|Lymphoplasmacytoid Lymphoma|T-cell Non-Hodgkin Lymphoma|Acute Lymphoid Leukemia|Acute Myeloid Leukemia|Waldenstrom Macroglobulinemia	Drug: VLS-101 Schedule 1|Drug: VLS-101 Schedule 2|Drug: VLS-101 Schedule 3	City of Hope National Medical Center, Duarte, California, United States|UC San Diego Moores Cancer Center, La Jolla, California, United States|UCLA Department of Medicine - Hematology/Oncology, Los Angeles, California, United States|University of Nebraska Medical Center, Omaha, Nebraska, United States|Northwell Health/CLL Research and Treatment Program, New Hyde Park, New York, United States|Weill Cornell Medical College - New York - Presbyterian Hospital, New York, New York, United States|University of Rochester Medical Center, Rochester, New York, United States|Oregon Health & Science University, Portland, Oregon, United States|MD Anderson Cancer Center, Houston, Texas, United States|The University of Texas MD Anderson Cancer Center, Houston, Texas, United States|University of Virginia, Charlottesville, Virginia, United States|Swedish Cancer Institute, Seattle, Washington, United States	https://ClinicalTrials.gov/show/NCT03833180
175	Lenalidomide and Ipilimumab After Stem Cell Transplant in Treating Patients With Hematologic or Lymphoid Malignancies	Recruiting	No Results Available	B-Cell Non-Hodgkin Lymphoma|Hematopoietic and Lymphoid Cell Neoplasm|Leukemia|Lymphoma|Plasma Cell Myeloma|T-Cell Non-Hodgkin Lymphoma	Biological: Ipilimumab|Drug: Lenalidomide	M D Anderson Cancer Center, Houston, Texas, United States	https://ClinicalTrials.gov/show/NCT01919619
176	Study to Assess Safety, Tolerability, Pharmacokinetics and Antitumor Activity of AZD4573 in Relapsed/Refractory Haematological Malignancies	Recruiting	No Results Available	Relapsed or Refractory Haematological Malignancies Including|Acute Myeloid Leukemia|Acute Lymphocytic Leukemia|Chronic Lymphocytic Leukemia|High Risk Myelodysplastic Syndrome|Chronic Myelomonocytic Leukemia|Richter's Syndrome|B-cell Non-Hodgkin Lymphoma|T-cell Non-Hodgkin Lymphoma|Small Lymphocytic Lymphoma|Multiple Myeloma	Drug: AZD4573	Research Site, Aachen, Germany|Research Site, Bonn, Germany|Research Site, Essen, Germany|Research Site, Göttingen, Germany|Research Site, Heidelberg, Germany|Research Site, Rheinland-Pfalz, Germany|Research Site, Ulm, Germany|Research Site, Amsterdam, Netherlands|Research Site, Kraków, Poland|Research Site, Skórzewo, Poland|Research Site, Cardiff, United Kingdom|Research Site, Leicester, United Kingdom|Research Site, Manchester, United Kingdom|Research Site, Nottingham, United Kingdom|Research Site, Plymouth, United Kingdom|Research Site, Southampton, United Kingdom|Research Site, Sutton, United Kingdom	https://ClinicalTrials.gov/show/NCT03263637
177	Gene Therapy in Treating Patients With Human Immunodeficiency Virus-Related Lymphoma Receiving Stem Cell Transplant	Recruiting	No Results Available	HIV Infection|Mature T-Cell and NK-Cell Non-Hodgkin Lymphoma|Plasmablastic Lymphoma|Recurrent Adult Hodgkin Lymphoma|Recurrent Adult Non-Hodgkin Lymphoma|Recurrent Burkitt Lymphoma|Recurrent Follicular Lymphoma|Stage III Follicular Lymphoma|Stage III Mantle Cell Lymphoma|Stage IV Follicular Lymphoma|Stage IV Mantle Cell Lymphoma	Procedure: Autologous Hematopoietic Stem Cell Transplantation|Drug: Carmustine|Drug: Cytarabine|Drug: Etoposide|Other: Laboratory Biomarker Analysis|Biological: Lentivirus Vector CCR5 shRNA/TRIM5alpha/TAR Decoy-transduced Autologous CD34-positive Hematopoietic Progenitor Cells|Drug: Melphalan|Procedure: Peripheral Blood Stem Cell Transplantation	UC San Diego Moores Cancer Center, La Jolla, California, United States|University of California Davis Comprehensive Cancer Center, Sacramento, California, United States|UCSF Medical Center-Parnassus, San Francisco, California, United States|Memorial Sloan Kettering Cancer Center, New York, New York, United States	https://ClinicalTrials.gov/show/NCT02797470
178	Irradiated Donor Cells Following Stem Cell Transplant in Controlling Cancer in Patients With Hematologic Malignancies	Recruiting	No Results Available	Acute Lymphoblastic Leukemia|Acute Myeloid Leukemia in Remission|Hematopoietic Cell Transplantation Recipient|JAK2 Gene Mutation|Loss of Chromosome 17p|Mantle Cell Lymphoma|Minimal Residual Disease|Myelodysplastic Syndrome|Non-Hodgkin Lymphoma|Plasma Cell Myeloma|RAS Family Gene Mutation|Recurrent Diffuse Large B-Cell Lymphoma|Recurrent Hematologic Malignancy|Recurrent Mature T- and NK-Cell Non-Hodgkin Lymphoma|Refractory Diffuse Large B-Cell Lymphoma|Refractory Mature T-Cell and NK-Cell Non-Hodgkin Lymphoma|Therapy-Related Acute Myeloid Leukemia|Therapy-Related Myelodysplastic Syndrome|TP53 Gene Mutation	Procedure: Allogeneic Hematopoietic Stem Cell Transplantation|Biological: Irradiated Allogeneic Cells	Rutgers Cancer Institute of New Jersey, New Brunswick, New Jersey, United States	https://ClinicalTrials.gov/show/NCT03272633
179	Dendritic Cell Therapy, Cryosurgery, and Pembrolizumab in Treating Patients With Non-Hodgkin Lymphoma	Recruiting	No Results Available	Aggressive Non-Hodgkin Lymphoma|Indolent Non-Hodgkin Lymphoma|Recurrent Diffuse Large B-Cell Lymphoma|Recurrent Follicular Lymphoma|Recurrent Mantle Cell Lymphoma|Recurrent Marginal Zone Lymphoma|Recurrent Non-Hodgkin Lymphoma|Recurrent Primary Mediastinal (Thymic) Large B-Cell Cell Lymphoma|Recurrent T-Cell Non-Hodgkin Lymphoma|Small Lymphocytic Lymphoma	Procedure: Cryosurgery|Biological: Dendritic Cell Therapy|Other: Laboratory Biomarker Analysis|Biological: Pembrolizumab|Biological: Pneumococcal 13-valent Conjugate Vaccine|Other: Quality-of-Life Assessment	Mayo Clinic in Rochester, Rochester, Minnesota, United States	https://ClinicalTrials.gov/show/NCT03035331
180	Fludarabine Phosphate, Cyclophosphamide, Total Body Irradiation, and Donor Stem Cell Transplant in Treating Patients With Blood Cancer	Recruiting	No Results Available	Accelerated Phase Chronic Myelogenous Leukemia, BCR-ABL1 Positive|Acute Leukemia in Remission|Acute Lymphoblastic Leukemia|Acute Myeloid Leukemia|Acute Myeloid Leukemia With FLT3/ITD Mutation|Acute Myeloid Leukemia With Gene Mutations|Aplastic Anemia|B-Cell Non-Hodgkin Lymphoma|CD40 Ligand Deficiency|Chronic Granulomatous Disease|Chronic Leukemia in Remission|Chronic Lymphocytic Leukemia|Chronic Myelogenous Leukemia, BCR-ABL1 Positive|Chronic Myelomonocytic Leukemia|Chronic Phase Chronic Myelogenous Leukemia, BCR-ABL1 Positive|Congenital Amegakaryocytic Thrombocytopenia|Congenital Neutropenia|Congenital Pure Red Cell Aplasia|Glanzmann Thrombasthenia|Immunodeficiency Syndrome|Myelodysplastic Syndrome|Myelofibrosis|Myeloproliferative Neoplasm|Paroxysmal Nocturnal Hemoglobinuria|Plasma Cell Myeloma|Polycythemia Vera|Recurrent Non-Hodgkin Lymphoma|Refractory Non-Hodgkin Lymphoma|Secondary Acute Myeloid Leukemia|Secondary Myelodysplastic Syndrome|Severe Aplastic Anemia|Shwachman-Diamond Syndrome|Sickle Cell Disease|T-Cell Non-Hodgkin Lymphoma|Thalassemia|Waldenstrom Macroglobulinemia|Wiskott-Aldrich Syndrome	Drug: Cyclophosphamide|Drug: Fludarabine Phosphate|Other: Laboratory Biomarker Analysis|Procedure: Peripheral Blood Stem Cell Transplantation|Radiation: Total-Body Irradiation	Roswell Park Cancer Institute, Buffalo, New York, United States	https://ClinicalTrials.gov/show/NCT03333486
181	PD-1 Knockout EBV-CTLs for Advanced Stage Epstein-Barr Virus (EBV) Associated Malignancies	Recruiting	No Results Available	Stage IV Gastric Carcinoma|Stage IV Nasopharyngeal Carcinoma|T-Cell Lymphoma Stage IV|Stage IV Adult Hodgkin Lymphoma|Stage IV Diffuse Large B-Cell Lymphoma	Drug: Fludarabine|Drug: Cyclophosphamide|Drug: Interleukin-2	The Comprehensive Cancer Center of Nanjing Drum Tower Hospital, Nanjing, Jiangsu, China|The Comprehensive Cancer Center of Nanjing Drum Tower Hospital, Nanjing, Jiangsu, China	https://ClinicalTrials.gov/show/NCT03044743
182	DS-3201b in Participants With Lymphomas	Recruiting	No Results Available	Lymphoma, Malignant|Non-hodgkin Lymphoma	Drug: DS-3201b	City of Hope National Medical center, Duarte, California, United States|Yale University, New Haven, Connecticut, United States|Emory University, Atlanta, Georgia, United States|Dana-Farber Cancer Institute, Boston, Massachusetts, United States|Hackensack University Medical Center, Hackensack, New Jersey, United States|Weill Cornell Medicine, New York, New York, United States|Memorial Sloan Kettering Cancer Center, New York, New York, United States|Thomas Jefferson University, Philadelphia, Pennsylvania, United States|Nagoya City University Hospital, Nagoya-shi, Aichi, Japan|National Cancer Center Hospital East, Kahiwa-shi, Chiba, Japan|Iwate Medical University Hospital, Morioka-shi, Iwate, Japan|Imamura General Hospital, Kagoshima-shi, Kagoshima, Japan|Kagoshima University Hospital, Kagoshima-shi, Kagoshima, Japan|Kumamoto University Hosipital, Kumamoto-shi, Kumamoto, Japan|Nagasaki University Hospital, Nagasaki-shi, Nagasaki, Japan|University of the Ryukyus Hospital, Nakagami-gun, Okinawa, Japan|The Institute of Medical Science, The University of Tokyo, Minato-ku, Tokyo, Japan|National Cancer Center Hospital, Chuo Ku, Toyko, Japan	https://ClinicalTrials.gov/show/NCT02732275
