Rank	Title	Status	Study Results	Conditions	Interventions	Locations	URL
205	Toripalimab in Combination With R-CHOP for Elderly Patients With Untreated Diffused B Cell Lymphoma	Recruiting	No Results Available	Diffuse Large B Cell Lymphoma|High-grade B-cell Lymphoma|Follicular Lymphoma Grade IIIb|Transformed Lymphoma|EBV-Positive DLBCL, Nos|ALK-Positive Anaplastic Large Cell Lymphoma	Drug: Toripalimab|Drug: R-CHOP Protocol	Department of hematology department, Nanfang hospital, Guangzhou, Guangdong, China	https://ClinicalTrials.gov/show/NCT04058470
206	Testing the Addition of an Anti-cancer Drug, Lenalidomide, to the Usual Combination Chemotherapy Treatment ("EPOCH") for Adult T-Cell Leukemia-Lymphoma (ATL)	Recruiting	No Results Available	Acute Adult T-Cell Leukemia/Lymphoma|Adult T-Cell Leukemia/Lymphoma|Chronic Adult T-Cell Leukemia/Lymphoma|HTLV-1 Infection	Drug: Cyclophosphamide|Drug: Doxorubicin Hydrochloride|Drug: Etoposide|Drug: Lenalidomide|Drug: Prednisone|Drug: Vincristine Sulfate	Emory University Hospital/Winship Cancer Institute, Atlanta, Georgia, United States|Siteman Cancer Center at West County Hospital, Creve Coeur, Missouri, United States|Washington University School of Medicine, Saint Louis, Missouri, United States|Siteman Cancer Center-South County, Saint Louis, Missouri, United States|Siteman Cancer Center at Saint Peters Hospital, Saint Peters, Missouri, United States|Memorial Sloan Kettering Cancer Center, New York, New York, United States|Ohio State University Comprehensive Cancer Center, Columbus, Ohio, United States	https://ClinicalTrials.gov/show/NCT04301076
207	Tislelizumab in Combination With Lenalidomide in Refractory and Relapsed Elderly Patients With Non-GCB DLBCL	Recruiting	No Results Available	Non-GCB/ABC Diffuse Large B-Cell Lymphoma|High-grade B-cell Lymphoma|Follicular Lymphoma Grade IIIb|Transformed Lymphoma|EBV-Positive DLBCL, Nos|ALK-Positive Anaplastic Large Cell Lymphoma	Drug: PD-1 Antibody|Drug: Lenalidomide	Department of Medical Oncology, Sun Yat-sen University Cancer Center,, Guangzhou, Guangdong, China	https://ClinicalTrials.gov/show/NCT04796857
208	CCCG-ALCL-2020 for Chinese Children and Adolescents With Newly Diagnosed High-risk ALCL	Recruiting	No Results Available	Pediatric Anaplastic Large Cell Lymphoma	Drug: P regimen|Drug: Course A1 + Vin|Drug: Course B1 +Vin|Drug: Course A2 + Vin|Drug: Course B2 +Vin|Drug: Course A3 + Vin|Drug: Course B3 +Vin|Drug: Maintenance therapy	Shanghai Children's Medical Center, Shanghai, China	https://ClinicalTrials.gov/show/NCT04881838
209	Brigatinib in Pediatric and Young Adult Patients With ALK+ ALCL, IMT or Other Solid Tumors	Not yet recruiting	No Results Available	Anaplastic Large Cell Lymphoma, ALK-Positive|Inflammatory Myofibroblastic Tumor|Other Solid Tumor	Drug: Brigatinib		https://ClinicalTrials.gov/show/NCT04925609
210	Vinorelbine for Recurrent ALCL-2017	Recruiting	No Results Available	Anaplastic Large Cell Lymphoma|Vinorelbine	Drug: Vinorelbine	Shanghai Children's Medical Center, Shanghai, Shanghai, China	https://ClinicalTrials.gov/show/NCT03443128
211	Dual Target CAR-T Cells in B-cell Lymphoma	Recruiting	No Results Available	Lymphoma, B-Cell|Relapse/Recurrence|Refractory Lymphoma|Dual-target CAR-T Cells	Biological: dual target CAR-T cell therapy	Shenzhen University General hospital, Shenzhen, Guangdong, China	https://ClinicalTrials.gov/show/NCT04723914
212	The Clinical Study of CD20 CAR-T Cells in Patients With Relapsed and Refractory B Cell Non-Hodgkin Lymphoma	Recruiting	No Results Available	Relapsed and Refractory B Cell Lymphoma|Non-Hodgkin Lymphoma	Biological: CD20 CAR-T	The First Affiliated Hospital with Nanjing Medical University, Nanjing, Jiangsu, China	https://ClinicalTrials.gov/show/NCT04169932
213	Clinical Study of SenL-T7 CAR T Cells in the Treatment of Relapsed and Refractory CD7+ Leukemia or T-cell Lymphoblastic Lymphoma	Recruiting	No Results Available	SenL-T7 CAR T Cells for CD7+ Leukemia or T-LBL	Biological: Senl-T7	Hebei yanda Ludaopei Hospital, Beijing, Hebei, China	https://ClinicalTrials.gov/show/NCT04916860
214	Decitabine-primed Tandem CD19/CD20 CAR T Cells Treatment in r/r B-NHL	Recruiting	No Results Available	Relapase and Refractory B-cell Non-Hodgkin's Lymphoma|Decitabine-primed Tandem CD19/CD20 CAR T Cells	Biological: Decitabine-primed Tandem CAR19/20 engineered T cells	Biotherapeutic Department of Chinese PLA General Hospital, Beijing, Beijing, China	https://ClinicalTrials.gov/show/NCT04697940
215	CD30 CAR T Cells, Relapsed CD30 Expressing Lymphoma (RELY-30)	Recruiting	No Results Available	Hodgkin's Lymphoma|Non-Hodgkin Lymphoma	Genetic: CAR T Cells|Drug: Cyclophosphamide|Drug: Fludarabine	Houston Methodist Hospital, Houston, Texas, United States|Texas Children's Hospital, Houston, Texas, United States	https://ClinicalTrials.gov/show/NCT02917083
216	Immunotherapy With CD19 CAR T-cells for B-Cell Lymphoma	Not yet recruiting	No Results Available	Lymphoma	Biological: Anti-CD19-CAR		https://ClinicalTrials.gov/show/NCT04100187
217	CD19-targeted CAR T Cells for Relapsed and Refractory (R/R) Mantle Cell Lymphoma	Recruiting	No Results Available	Mantle Cell Lymphoma	Biological: CD19-targeted Chimeric Antigen Receptor (CAR) T Cells	Peking University Cancer Hospital, Beijing, Beijing, China|Peking University Third Hospital, Beijing, Beijing, China|Fujian Medical University Consonancy Hospital, Fuzhou, Fujiang, China|Guangdong Province people hospital, Guanzhou, Guangdong, China|Henan Province Cancer Hospital, Zhengzhou, Henan, China|Jiangsu Province People Hospital, Nanjing, Jiangsu, China|Fudan University Shanghai Cancer Center, Shanghai, Shanghai, China|Zhongshan Hospital affiliated to Fudan University, Shanghai, Shanghai, China|Institute of Hematology, Chinese Academy of Medical Sciences, Tianjin, Tianjin, China|Tianjin Cancer Hospital, Tianjin, Tianjin, China|The First Affiliated Hospital of Zhejiang University, Hangzhou, Zhejiang, China|Zhejiang province Cancer Hospital, Hangzhou, Zhejiang, China	https://ClinicalTrials.gov/show/NCT04718883
218	Multi-CAR-T Cells Targeting B Cell Lymphomas	Recruiting	No Results Available	B Cell Lymphoma (BCL)	Biological: 4SCAR19 and 4SCAR20/22/70/PSMA/13/79b/GD2	Shenzhen Children's Hospital, Shenzhen, Guangdong, China|Shenzhen Geno-Immune Medical Institute, Shenzhen, Guangdong, China|The Seventh Affilliated Hospital, Sun Yat-Sen University, Shenzhen, Guangdong, China	https://ClinicalTrials.gov/show/NCT04429438
219	Study of Feasibility and Safety of UCD19 Chimeric Antigen Receptor (CAR) T Cells in Adult Subjects With Relapsed/Refractory (R/R) B-Cell Non-Hodgkin's Lymphoma (B-NHL)	Recruiting	No Results Available	Non Hodgkin Lymphoma	Biological: UCD19 CAR T Cells	University of Colorado Hospital, Aurora, Colorado, United States	https://ClinicalTrials.gov/show/NCT04240808
220	Tumor Associated Antigen Specific T Cells (TAA-T) With PD1 Inhibitor for Lymphoma	Recruiting	No Results Available	Hodgkin Lymphoma|Diffuse Large B Cell Lymphoma	Biological: TAA-T cells|Drug: Nivolumab	Children's National Medical Center, Washington, District of Columbia, United States|Utah University School of Medicine/Huntsman Cancer Institute, Salt Lake City, Utah, United States	https://ClinicalTrials.gov/show/NCT03843294
221	Autologous TAC T Cells Targeting CD19 in R/R Large B-Cell Lymphoma	Not yet recruiting	No Results Available	Lymphoma, B-Cell	Biological: TAC01-CD19		https://ClinicalTrials.gov/show/NCT03880279
222	Study of PD-1 Inhibitors After CD30.CAR T Cell Therapy in Relapsed/Refractory Hodgkin Lymphoma	Recruiting	No Results Available	Relapsed Hodgkin Lymphoma|Refractory Hodgkin Lymphoma	Biological: Nivolumab|Biological: Pembrolizumab	Lineberger Comprehensive Cancer Center at University of North Carolina, Chapel Hill, North Carolina, United States	https://ClinicalTrials.gov/show/NCT04134325
223	CD19-targeted CAR T Cells for Relapsed and Refractory (R/R) Non-Hodgkins Lymphoma	Recruiting	No Results Available	Lymphoma, Non-Hodgkin|Diffuse Large B Cell Lymphoma|Follicular Lymphoma	Biological: CD19-targeted Chimeric Antigen Receptor (CAR) T Cells	Beijing Cancer Hospital, Beijing, Beijing, China|Beijing Friendship Hospital, Capital Medical University, Beijing, Beijing, China|Beijing Hospital, Beijing, Beijing, China|Peking Union Medical College Hospital, Beijing, Beijing, China|Guangdong General Hospital, Guangzhou, Guangdong, China|The First Affiliated Hospital of Zhenzhou Universtity, Zhenzhou, Henan, China|Jiangsu Cancer Hospital, Nanjing, Jiangsu, China|Shanghai East Hospital, Shanghai, Shanghai, China|Institute of Hematology&Hospital of Blood Disease CAMS, Tianjin, Tianjin, China|Zhejiang Cancer Hospital, Hangzhou, Zhejiang, China	https://ClinicalTrials.gov/show/NCT04089215
224	Targeting CD19 and CD22 CAR-T Cells Immunotherapy in Patients With Relapsed or Refractory B Cell Lymphoma	Recruiting	No Results Available	Lymphoma, B-Cell	Biological: CD19-CD22 CAR-T cells	Hematology Department of ShanXi Cancer Hospital, Taiyuan, Shanxi, China	https://ClinicalTrials.gov/show/NCT04715217
225	Immunotherapy Using CAR T-cells to Target CD19 for Relapsed/Refractory CD19+ Primary CNS Lymphoma	Recruiting	No Results Available	Primary CNS Lymphoma	Biological: CD19CAR T-cells	University College London Hospital, London, United Kingdom	https://ClinicalTrials.gov/show/NCT04443829
226	Clinical Trial of SL1904B CAR-T Cells for Relapsed or Refractory Non-Hodgkin Lymphoma	Recruiting	No Results Available	Non-hodgkin's Lymphoma	Biological: CD19 CAR-T	BeiJing Ludaopei Hospital, Beijing, Yizhuang, China|He bei Yan da Lu dao pei Hospital, Yanda, China	https://ClinicalTrials.gov/show/NCT04447547
227	Anti-CD19:TCRζ Chimeric Antigen Receptor-T Cells in the Treatment for CD19+ B Cell Lymphoma	Not yet recruiting	No Results Available	Lymphoma, B Cell	Biological: IL-2 pre-treated CD19 cells|Biological: IL-7/IL-15 pre-treated CD19 cells	First People's Hospital of Changzhou, Changzhou, Jiangsu, China	https://ClinicalTrials.gov/show/NCT02992834
228	Modified Immune Cells (CD19 CAR T Cells) and Acalabrutinib for the Treatment of Relapsed or Refractory Mantle Cell Lymphoma	Recruiting	No Results Available	Recurrent Mantle Cell Lymphoma|Refractory Mantle Cell Lymphoma	Drug: Acalabrutinib|Biological: CD19CAR-CD28-CD3zeta-EGFRt-expressing Tn/mem-enriched T-lymphocytes	City of Hope Comprehensive Cancer Center, Duarte, California, United States	https://ClinicalTrials.gov/show/NCT04484012
229	CD19-targeted CAR T Cells （JWCAR029） for Primary Refractory Diffuse Large B Cell Lymphoma	Recruiting	No Results Available	Diffuse Large B Cell Lymphoma	Biological: JWCAR029 (CD19-targeted Chimeric Antigen Receptor Cells)	Ruijin hospital, Shanghai, Shanghai, China|Zhejiang university school of medicine first affiliated hospital, Hangzhou, Zhejiang, China	https://ClinicalTrials.gov/show/NCT04812691
230	Safety and Efficacy of ALLO-501A Anti-CD19 Allogeneic CAR T Cells in Adults With Relapsed/Refractory Large B Cell Lymphoma (ALPHA-2)	Recruiting	No Results Available	Relapsed/Refractory Large B Cell Lymphoma	Genetic: ALLO-501A|Biological: ALLO-647|Drug: Fludarabine|Drug: Cyclophosphamide	City of Hope, Duarte, California, United States|UCLA Medical Center, Los Angeles, California, United States|Stanford Cancer Institute, Palo Alto, California, United States|Colorado Blood Cancer Institute, Denver, Colorado, United States|University of Miami, Miami, Florida, United States|Moffitt Cancer Center, Tampa, Florida, United States|Norton Cancer Institute, Louisville, Kentucky, United States|Harvard Massachusetts General Hospital, Boston, Massachusetts, United States|Montefiore Einstein Center for Cancer Care, Bronx, New York, United States|University of Pennsylvania, Philadelphia, Pennsylvania, United States|St. David's South Austin Medical Center, Austin, Texas, United States|MD Anderson Cancer Center - University of Texas, Houston, Texas, United States|Medical College of Wisconsin, Milwaukee, Wisconsin, United States	https://ClinicalTrials.gov/show/NCT04416984
231	Anti-CD19 CAR-T Cells for Relapsed or Refractory Acute Lymphoblastic Leukemia and Lymphomas	Recruiting	No Results Available	Acute Lymphoblastic Leukemia ,Lymphomas	Biological: Anti-CD19 CAR-T	The First Affiliated Hospital of Nangchang University, Nanchang, Jiangxi, China	https://ClinicalTrials.gov/show/NCT04196205
232	Duvelisib Exposure to Enhance Immune Profiles of T Cells in Patients With Recurrent or Refractory Diffuse Large B-Cell Lymphoma, DEEP T CELLS Study	Not yet recruiting	No Results Available	Recurrent Diffuse Large B-Cell Lymphoma|Refractory Diffuse Large B-Cell Lymphoma	Drug: Duvelisib|Biological: Tisagenlecleucel	Emory University Hospital/Winship Cancer Institute, Atlanta, Georgia, United States|University of Chicago Comprehensive Cancer Center, Chicago, Illinois, United States	https://ClinicalTrials.gov/show/NCT04890236
233	Safety and Efficacy of ALLO-501 Anti-CD19 Allogeneic CAR T Cells in Adults With Relapsed/Refractory Large B Cell or Follicular Lymphoma	Recruiting	No Results Available	Relapsed/Refractory Large B Cell Lymphoma|Relapsed/Refractory Follicular Lymphoma	Genetic: ALLO-501|Biological: ALLO-647|Drug: Fludarabine|Drug: Cyclophosphamide	Banner MD Anderson Cancer Center, Gilbert, Arizona, United States|University of California, Los Angeles, Los Angeles, California, United States|Stanford University, Stanford, California, United States|Colorado Blood Cancer Institute, Denver, Colorado, United States|Moffitt Cancer Center, Tampa, Florida, United States|Norton Cancer Institute, Louisville, Kentucky, United States|St. Davids South Austin Medical Center, Austin, Texas, United States|MD Anderson, Houston, Texas, United States	https://ClinicalTrials.gov/show/NCT03939026
234	Auto Stem Cell Transplant for Lymphoma Patients	Recruiting	No Results Available	Non-Hodgkin Lymphoma|Hodgkin Lymphoma	Drug: Etoposide|Drug: BCNU|Drug: AraC|Drug: Melphalan|Procedure: Peripheral blood stem cell transplantation|Biological: G-CSF|Drug: Cyclophosphamide|Radiation: Total Body Irradiation	Masonic Cancer Center, University of Minnesota, Minneapolis, Minnesota, United States	https://ClinicalTrials.gov/show/NCT03125642
235	A Clinical Research of CAR T Cells Targeting CD19 Positive Malignant B-cell Derived Leukemia and Lymphoma	Recruiting	No Results Available	Leukemia|Lymphoma	Biological: Chimeric Antigen Receptor Modified T cells Targeting CD19	Southwest Hospital of Third Millitary Medical University, Chongqing, Chongqing, China	https://ClinicalTrials.gov/show/NCT02349698
236	Anakinra for the Prevention of Cytokine Release Syndrome and Neurotoxicity in Patients With B-Cell Lymphoma Receiving CD19-Targeted CAR-T Cell Therapy	Not yet recruiting	No Results Available	B-Cell Non-Hodgkin Lymphoma	Biological: Anakinra|Biological: Axicabtagene Ciloleucel	Fred Hutch/University of Washington Cancer Consortium, Seattle, Washington, United States	https://ClinicalTrials.gov/show/NCT04359784
237	A Study of CC-97540, CD19-targeted NEX-T Chimeric Antigen Receptor (CAR) T Cells, in Subjects With Relapsed or Refractory B-cell Non-Hodgkin Lymphoma	Recruiting	No Results Available	Lymphoma Non-Hodgkin|Agressive Lymphoma|Diffuse-large B-cell Lymphoma (DLBCL)	Biological: CC-97540	University of Alabama, Birmingham, Alabama, United States|Northside Hospital - Blood and Bone Marrow Transplant Group of Georgia, Atlanta, Georgia, United States|Massachusetts General Hospital, Boston, Massachusetts, United States|University of Nebraska Medical Center, Omaha, Nebraska, United States|Hackensack University Medical Center, Hackensack, New Jersey, United States|Memorial Sloan Kettering Cancer Center, New York, New York, United States|Weill Cornell Medicine, New York, New York, United States|Levine Cancer Institute, Charlotte, North Carolina, United States|Oregon Health & Science University (OHSU), Portland, Oregon, United States|Huntsman Cancer Institute, Salt Lake City, Utah, United States	https://ClinicalTrials.gov/show/NCT04231747
238	Treatment by a Bispecific CD3xCD20 Antibody for Relapse/Refractory Lymphomas After CAR T-cells Therapy	Recruiting	No Results Available	Diffuse Large B-Cell Lymphoma Refractory|Refractory Indolent Adult Non-Hodgkin Lymphoma|Refractory Transformed B-cell Non-Hodgkin Lymphoma|Refractory Primary Mediastinal Large B-Cell Cell Lymphoma|Refractory Mantle Cell Lymphoma	Drug: Obinutuzumab|Drug: RO7082859	CHU de Clermont Ferrand, Clermont Ferrand, France|Hopital Henri Mondor, Créteil, France|CHU de Dijon - Hôpital le Bocage, Dijon, France|CHRU Lille - Hôpital Claude Huriez, Lille, France|CHU Montpellier, Montpellier, France|CHU Nantes, Nantes, France|Hôpital Saint Louis, Paris, France|APHP - Hôpital de la Pitiè Salpetrière, Paris, France|APHP - Hôpital Saint Antoine, Paris, France|CHU de Bordeaux - Hôpital Haut Leveque, Pessac, France|CHU Lyon Sud, Pierre Bénite, France|CHU de Rennes - Hôpital Pontchaillou, Rennes, France|Centre Henri Becquerel, Rouen, France|IUCT Oncopole, Toulouse, France|CHU de Brabois, Vandoeuvre les Nancy, France	https://ClinicalTrials.gov/show/NCT04703686
239	Human CD19 Targeted T Cells Injection(CD19 CAR-T) Therapy for Relapsed and Refractory CD19-positive Lymphoma.	Recruiting	No Results Available	CD19-positive|Diffuse Large B-cell Lymphoma|Follicular Lymphoma	Drug: Human CD19 targeted T Cells Injection	The Second Affiliated Hospital of Nanchang University, Nanchang, Jiangxi, China|Fudan University Zhongshan Hospital, Shanghai, Shanghai, China|The First Affilicated Hospital of Wenzhou Medical University, Wenzhou, Zhejiang, China	https://ClinicalTrials.gov/show/NCT03720457
240	CD19/20 Bispecific Nanobody-derived CAR-T Cells in B Cell Lymphoma	Recruiting	No Results Available	B-Cell Lymphoma Stage I|Refractory|Relapsed	Biological: CD19/CD20 bispecific CAR-T cells	Cancer Hospital Affiliate to Zhengzhou University & Henan Cancer Hospital, Zhengzhou, Henan, China|Henan Cancer Hospital, Zhengzhou, Henan, China	https://ClinicalTrials.gov/show/NCT03881761
241	CD19 CAR and PD-1 Knockout Engineered T Cells for CD19 Positive Malignant B-cell Derived Leukemia and Lymphoma	Not yet recruiting	No Results Available	Acute Lymphoblastic Leukemia|Burkitt Lymphoma	Biological: CD19 CAR and PD-1 knock out engineered T-cells|Biological: CD19 CAR T-cells		https://ClinicalTrials.gov/show/NCT03298828
242	ET019003-T Cells in Relapsed/Refractory CD19+ B-Cell Leukemia and Lymphoma	Recruiting	No Results Available	Leukemia|Lymphoma	Drug: ET019003-T Cells	Union Hospital, Tongji Medical College, Huazhong University of Science and Technology, Wuhan, Hubei, China	https://ClinicalTrials.gov/show/NCT04014894
243	CD19/22 CAR T Cells (AUTO3) for the Treatment of Diffuse Large B Cell Lymphoma	Recruiting	No Results Available	Diffuse Large B Cell Lymphoma|Relapsed Diffuse Large B-Cell Lymphoma|Refractory Diffuse Large B-Cell Lymphoma|DLBCL	Biological: AUTO3	City of Hope Hospital, Duarte, California, United States|Colorado Blood Cancer Institute at Presbyterian/St. Luke's Medical Center/Sarah Cannon Research Institute, Denver, Colorado, United States|Sylvester Comprehensive Cancer Center / University of Miami, Miami, Florida, United States|Siteman Cancer Center / Washington University School of Medicine, Saint Louis, Missouri, United States|Memorial Sloan Kettering Cancer Center, New York, New York, United States|TriStar Centennial Medical Center /Sarah Cannon Research Institute, Nashville, Tennessee, United States|St David's South Austin Medical Center /Sarah Cannon Research Institute, Austin, Texas, United States|The Beatson West of Scotland Cancer Centre / Queen Elizabeth University Hospital, Glasgow, United Kingdom|University College London Hospitals NHS Foundation Trust, London, United Kingdom|Manchester University NHS Foundation Trust, Manchester, United Kingdom|Freeman Hospital, The Newcastle upon Tyne Hospitals NHS Foundation Trust, Newcastle upon Tyne, United Kingdom	https://ClinicalTrials.gov/show/NCT03287817
244	Blinatumomab Expanded T-cells (BET) in Indolent Non-Hodgkin Lymphomas/Chronic Lymphocytic Leukemia	Recruiting	No Results Available	Indolent Non-Hodgkin Lymphomas/Chronic Lymphocytic Leukemia	Biological: Blinatumomab Expanded T-cells (BET)	ASST - Papa Giovanni XXIII, Bergamo, Italy	https://ClinicalTrials.gov/show/NCT03823365
245	Reduced Intensity (RIC) Conditioning And Transplantation of HLA-Haplo-HCT	Recruiting	No Results Available	Hematologic Malignancies	Biological: Haplo HCT <55 years old|Biological: Haplo HCT ≥55 years old|Drug: GVHD Prophylaxis|Biological: Haplo HCT ≥55 and < 65 years old|Biological: Haplo HCT ≥65 and ≤75 years old	Masonic Cancer Center at University of Minnesota, Minneapolis, Minnesota, United States	https://ClinicalTrials.gov/show/NCT02988466
246	Anti-CD19 Chimeric Antigen Receptor T Cells for Treatment of Relapsed or Refractory Non-Hodgkin Lymphoma	Recruiting	No Results Available	Refractory Non-Hodgkin Lymphoma|Burkitt Lymphoma|Mantle Cell Lymphoma|Follicular Lymphoma|Lymphoplasmacytic Lymphoma|Primary Mediastinal Large B Cell Lymphoma|Diffuse Large B Cell Lymphoma|Small Lymphocytic Lymphoma|Transformed Lymphoma	Drug: Fludarabine|Drug: Cyclophosphamide|Biological: anti-CD19 CAR-T cells	University of California, San Francisco, San Francisco, California, United States	https://ClinicalTrials.gov/show/NCT04545762
247	Cell Therapy for High Risk T-Cell Malignancies Using CD7-Specific CAR Expressed On Autologous T Cells	Not yet recruiting	No Results Available	T-cell Acute Lymphoblastic Leukemia|T-cell Acute Lymphoblastic Lymphoma|T-non-Hodgkin Lymphoma	Genetic: CD7.CAR/28zeta CAR T cells|Drug: Fludarabine|Drug: Cytoxan	Houston Methodist Hospital, Houston, Texas, United States|Texas Children's Hospital, Houston, Texas, United States	https://ClinicalTrials.gov/show/NCT03690011
248	CD19 CAR-T Cell Therapy for Relapsed/Refractory B-cell Lymphoma and B-cell Acute Lymphoblastic Leukemia	Recruiting	No Results Available	B Cell Lymphoma|B-cell Acute Lymphoblastic Leukemia	Biological: Anti-CD19 CAR-T Cells Injection	Kunming Yan'an Hospital, Oncology Department, Kunming, Yunnan, China	https://ClinicalTrials.gov/show/NCT03854994
249	Acalabrutinib and Anti-CD19 CAR T-cell Therapy for the Treatment of B-cell Lymphoma	Recruiting	No Results Available	B-Cell Non-Hodgkin Lymphoma|Diffuse Large B-Cell Lymphoma, Not Otherwise Specified|High Grade B-Cell Lymphoma|Primary Mediastinal (Thymic) Large B-Cell Lymphoma|Transformed Follicular Lymphoma to Diffuse Large B-Cell Lymphoma	Drug: Acalabrutinib|Biological: Axicabtagene Ciloleucel	Fred Hutch/University of Washington Cancer Consortium, Seattle, Washington, United States	https://ClinicalTrials.gov/show/NCT04257578
250	Immunotherapy With CD22 CAR T-cells for B-Cell Lymphoma, ALL and CLL	Not yet recruiting	No Results Available	Leukemia|Lymphoma	Biological: :Anti-CD22-CAR		https://ClinicalTrials.gov/show/NCT04163575
251	Anti-CD19 CAR in PiggyBac Transposon-Engineered T Cells for Relapsed/Refractory B-cell Lymphoma or B-cell Acute Lymphoblastic Leukemia	Recruiting	No Results Available	B Cell Lymphoma|B-cell Acute Lymphoblastic Leukemia	Biological: Anti-CD19 CAR-T Cells Injection	Kunming Yan'an Hospital, Kunming, Yunnan, China	https://ClinicalTrials.gov/show/NCT04289220
252	Immunotherapy With CD19 CAR T-cells for B-Cell Lymphoma, ALL and CLL	Not yet recruiting	No Results Available	Leukemia|Lymphoma	Biological: Anti-CD19-CAR	Beijing Cancer Hospital, Beijing, Beijing, China|The First Affiliated Hospital of Guangzhou Medical University, Guangzhou, Guangdong, China|Hebei Yanda Ludaopei Hospital, Sanhe, Hebei, China|First Affiliated Hospital of Henan University of Science and Technology, Luoyang, Henan, China|The First Affiliated Hospital of Zhengzhou University, Zhengzhou, Henan, China|Huai'An First People'S Hospital, Huaian, Jiangsu, China|Nanjing Drum Tower Hospital, Nanjing, Jiangsu, China|First Hospital of Jilin University, Changchun, Jilin, China|Shanxi Dayi Hospital, Taiyuan, Shanxi, China|Tianjin people's hospital, Tianjin, Tianjin, China|Hangzhou Cancer Hospital, Hangzhou, Zhejiang, China|Beijing DOING Biomedical Co., Ltd, Beijing, China	https://ClinicalTrials.gov/show/NCT02546739
253	Anti-CD19 CAR-T Cells With Inducible Caspase 9 Safety Switch for B-cell Lymphoma	Recruiting	No Results Available	Lymphoma|Lymphoma, B-Cell|Immune System Diseases|Immunoproliferative Disorders|Lymphatic Diseases	Biological: iC9-CAR19 T cells|Drug: Bendamustine|Drug: Fludarabine|Drug: AP1903|Drug: Cyclophosphamide	Lineberger Comprehensive Cancer Center at University of North Carolina - Chapel Hill, Chapel Hill, North Carolina, United States	https://ClinicalTrials.gov/show/NCT03696784
254	Phase 2 Study Evaluating Autologous CD30.CAR-T Cells in Patients With Relapsed/Refractory Hodgkin Lymphoma (CHARIOT)	Recruiting	No Results Available	Hodgkin Lymphoma, Adult|Hodgkin Disease Recurrent|Hodgkin Disease Refractory|Hodgkin Disease, Pediatric	Drug: CD30.CAR-T|Drug: Fludarabine|Drug: Bendamustine	City of Hope Comprehensive Cancer Center, Duarte, California, United States|University of Chicago Medical Center, Chicago, Illinois, United States|Children's Hospital of Philadelphia, Philadelphia, Pennsylvania, United States|Sarah Cannon Research Institute, Nashville, Tennessee, United States|MD Anderson Cancer Center, Houston, Texas, United States	https://ClinicalTrials.gov/show/NCT04268706
255	Autologous T-Cells Expressing a Second Generation CAR for Treatment of T-Cell Malignancies Expressing CD5 Antigen	Recruiting	No Results Available	T-cell Acute Lymphoblastic Lymphoma|T-non-Hodgkin Lymphoma|T-cell Acute Lymphoblastic Leukemia	Genetic: Autologous CD5.CAR/28zeta CAR T cells|Drug: Fludarabine|Drug: Cytoxan|Genetic: Allogeneic CD5.CAR/28zeta CAR T cells	Houston Methodist Hospital, Houston, Texas, United States|Texas Children's Hospital, Houston, Texas, United States	https://ClinicalTrials.gov/show/NCT03081910
